{
  "benchmark": "locomo",
  "instrument": "locomo-qa",
  "dataset": {
    "path": "benchmark/locomo/data/locomo10.json",
    "sha256": "79fa87e90f04081343b8c8debecb80a9a6842b76a7aa537dc9fdf651ea698ff4",
    "bytes": 2805274,
    "schemaValid": true,
    "conversations": 10,
    "restricted": null
  },
  "config": {
    "embedder": {
      "model": "hash-trigram-64",
      "dims": 64
    },
    "k": 10,
    "ingest": "per-session",
    "clock": "the last session instant of each conversation",
    "maxPairs": 20
  },
  "corpus": {
    "conversations": 10,
    "sessions": 272,
    "refusedSessions": 0,
    "turns": 5882,
    "imageTurns": 910,
    "collapsed": 5,
    "span": {
      "start": "2022-01-21T19:31:00.000Z",
      "end": "2024-01-12T13:41:00.000Z"
    }
  },
  "corpora": {
    "observation": {
      "blocks": 272,
      "orphanBlocks": 0,
      "empty": 0,
      "entries": 2541,
      "references": 2561,
      "listReferences": 15,
      "unresolved": 0,
      "collapsed": 0,
      "chars": 223487
    },
    "summary": {
      "blocks": 272,
      "orphanBlocks": 0,
      "empty": 0,
      "entries": 272,
      "references": 5882,
      "listReferences": 272,
      "unresolved": 0,
      "collapsed": 0,
      "chars": 177694
    }
  },
  "questions": {
    "total": 1986,
    "scorable": 1540,
    "byCategory": {
      "1": 282,
      "2": 321,
      "3": 96,
      "4": 841,
      "5": 446
    },
    "noEvidence": 4,
    "excluded": {
      "category": 5,
      "count": 446,
      "reason": "adversarial questions carry no `answer` (444 of 446) and the official evaluator scores the category by keyword, which marks the factually correct answer wrong; the judge lane below reports them separately"
    }
  },
  "sample": {
    "seed": 17753,
    "perCategory": 16,
    "adversarial": 6,
    "scorable": 64,
    "byCategory": {
      "1": 16,
      "2": 16,
      "3": 16,
      "4": 16,
      "5": 6
    },
    "ids": [
      "conv-26#39",
      "conv-26#66",
      "conv-26#67",
      "conv-26#117",
      "conv-26#150",
      "conv-26#197",
      "conv-30#5",
      "conv-30#12",
      "conv-41#21",
      "conv-41#31",
      "conv-41#32",
      "conv-41#45",
      "conv-41#50",
      "conv-41#64",
      "conv-41#104",
      "conv-41#160",
      "conv-42#4",
      "conv-42#11",
      "conv-42#33",
      "conv-42#39",
      "conv-42#66",
      "conv-42#70",
      "conv-42#85",
      "conv-42#86",
      "conv-42#98",
      "conv-42#107",
      "conv-42#127",
      "conv-42#159",
      "conv-43#1",
      "conv-43#5",
      "conv-43#6",
      "conv-43#8",
      "conv-43#11",
      "conv-43#16",
      "conv-43#18",
      "conv-43#19",
      "conv-43#34",
      "conv-43#43",
      "conv-43#213",
      "conv-44#7",
      "conv-44#44",
      "conv-44#51",
      "conv-44#122",
      "conv-47#44",
      "conv-47#51",
      "conv-47#58",
      "conv-47#154",
      "conv-48#2",
      "conv-48#5",
      "conv-48#27",
      "conv-48#32",
      "conv-48#40",
      "conv-48#126",
      "conv-49#13",
      "conv-49#14",
      "conv-49#66",
      "conv-49#88",
      "conv-49#126",
      "conv-50#4",
      "conv-50#22",
      "conv-50#42",
      "conv-50#47",
      "conv-50#65",
      "conv-50#71",
      "conv-50#107",
      "conv-50#109",
      "conv-50#150",
      "conv-50#155",
      "conv-50#163",
      "conv-50#183"
    ]
  },
  "gate": {
    "passed": true,
    "failures": [],
    "oracle": {
      "overall": 1,
      "byCategory": {
        "1": 1,
        "2": 1,
        "3": 1,
        "4": 1
      }
    },
    "released": {
      "overall": 0.9954732537680026,
      "byCategory": {
        "1": 1,
        "2": 1,
        "3": 0.9273834458617066,
        "4": 1
      }
    }
  },
  "configurations": [
    {
      "key": "long-context",
      "label": "long context (the whole conversation in the request)",
      "kind": "long-context",
      "ceiling": {
        "all": {
          "overall": 0.996134817563389,
          "byCategory": {
            "1": 0.9942586963863561,
            "2": 0.9968847352024922,
            "3": 0.96875,
            "4": 0.9996036464526357
          }
        },
        "sample": {
          "overall": 0.9977678571428572,
          "byCategory": {
            "1": 0.9910714285714286,
            "2": 1,
            "3": 1,
            "4": 1
          }
        }
      },
      "verbatim": null
    },
    {
      "key": "near-raw",
      "label": "RAG over dialog turns (the pipeline, policies off)",
      "kind": "pipeline",
      "corpus": "turns",
      "thresholds": {
        "novelty": 2,
        "contradiction": 2,
        "crystallize": 2
      },
      "ingest": {
        "runs": 272,
        "observations": 5882,
        "embedded": 5882,
        "admitted": 5882,
        "filtered": 0,
        "judged": 0,
        "contradictions": 0,
        "resolutions": 0,
        "merged": 0,
        "live": 5877,
        "total": 5877,
        "superseded": 0
      },
      "retrieval": {
        "unranked": 0
      },
      "ceiling": {
        "all": {
          "overall": 0.17407014748773222,
          "byCategory": {
            "1": 0.07260599246881441,
            "2": 0.20768431983385255,
            "3": 0.07215073529411765,
            "4": 0.20689655172413793
          }
        },
        "sample": {
          "overall": 0.19921875,
          "byCategory": {
            "1": 0.03125,
            "2": 0.25,
            "3": 0.140625,
            "4": 0.375
          }
        }
      },
      "verbatim": {
        "all": {
          "overall": 0.017608704762793692,
          "byCategory": {
            "1": 0.054158192336484015,
            "2": 0.002670226963460033,
            "3": 0.010678469596601944,
            "4": 0.01184603942838209
          }
        },
        "sample": {
          "overall": 0.015390471965449959,
          "byCategory": {
            "1": 0.03238632608515813,
            "2": 0.004107892106678402,
            "3": 0.014406694141580674,
            "4": 0.010660975528382624
          }
        }
      }
    },
    {
      "key": "rag-observation",
      "label": "RAG over the release's observations",
      "kind": "rag",
      "corpus": "observation",
      "thresholds": {
        "novelty": 2,
        "contradiction": 2,
        "crystallize": 2
      },
      "ingest": {
        "runs": 272,
        "observations": 2541,
        "embedded": 2541,
        "admitted": 2541,
        "filtered": 0,
        "judged": 0,
        "contradictions": 0,
        "resolutions": 0,
        "merged": 0,
        "live": 2541,
        "total": 2541,
        "superseded": 0
      },
      "retrieval": {
        "unranked": 0
      },
      "ceiling": {
        "all": {
          "overall": 0.3531949489234581,
          "byCategory": {
            "1": 0.17498131612073392,
            "2": 0.44132917964693663,
            "3": 0.1657169117647059,
            "4": 0.40071343638525564
          }
        },
        "sample": {
          "overall": 0.29947916666666663,
          "byCategory": {
            "1": 0.05208333333333333,
            "2": 0.40625,
            "3": 0.23958333333333331,
            "4": 0.5
          }
        }
      },
      "verbatim": {
        "all": {
          "overall": 0.02849319637774822,
          "byCategory": {
            "1": 0.058216139277593754,
            "2": 0.005856635681630393,
            "3": 0.018684824694371462,
            "4": 0.028286382783576456
          }
        },
        "sample": {
          "overall": 0.032648223195475216,
          "byCategory": {
            "1": 0.07238906866300338,
            "2": 0.00837890057029812,
            "3": 0.024647080977250914,
            "4": 0.025177842571348467
          }
        }
      }
    },
    {
      "key": "rag-summary",
      "label": "RAG over the release's session summaries",
      "kind": "rag",
      "corpus": "summary",
      "thresholds": {
        "novelty": 2,
        "contradiction": 2,
        "crystallize": 2
      },
      "ingest": {
        "runs": 272,
        "observations": 272,
        "embedded": 272,
        "admitted": 272,
        "filtered": 0,
        "judged": 0,
        "contradictions": 0,
        "resolutions": 0,
        "merged": 0,
        "live": 272,
        "total": 272,
        "superseded": 0
      },
      "retrieval": {
        "unranked": 0
      },
      "ceiling": {
        "all": {
          "overall": 0.5717555361277467,
          "byCategory": {
            "1": 0.4887019625681441,
            "2": 0.5869678089304259,
            "3": 0.41256498811645875,
            "4": 0.6119698771304003
          }
        },
        "sample": {
          "overall": 0.5626860119047619,
          "byCategory": {
            "1": 0.5111607142857143,
            "2": 0.6875,
            "3": 0.36458333333333337,
            "4": 0.6875
          }
        }
      },
      "verbatim": {
        "all": {
          "overall": 0.02794492492287671,
          "byCategory": {
            "1": 0.13048892422745245,
            "2": 0.004045323661814558,
            "3": 0.004989929561757545,
            "4": 0.005302884204182333
          }
        },
        "sample": {
          "overall": 0.026697469747474577,
          "byCategory": {
            "1": 0.09295375059858345,
            "2": 0.0035817682839522553,
            "3": 0.006601966877704247,
            "4": 0.003652393229658361
          }
        }
      }
    },
    {
      "key": "long-horizon",
      "label": "long-horizon agent (createLongHorizonAgent over createEnvironment)",
      "kind": "long-horizon",
      "ceiling": null,
      "verbatim": null
    },
    {
      "key": "near",
      "label": "Tangle (the pipeline, shipped defaults)",
      "kind": "pipeline",
      "corpus": "turns",
      "thresholds": {
        "novelty": 0.97,
        "contradiction": 0.8,
        "crystallize": 0.9
      },
      "ingest": {
        "runs": 272,
        "observations": 5882,